Description,Views,Likes,Comments,Shares,Bookmarks,Post URL,Post Date
"Being a woman in sports means strength, confidence, and breaking every mold. Feeling beautiful along the way only adds to that power. Sky High Mascara from @Maybelline NY 💫 #MaybellinePartner",8893,682,28,4,11,https://www.tiktok.com/@ilonamaher/video/7620475007629561102,3/23/2026 8:35
,225000,36100,126,85,314,https://www.tiktok.com/@ilonamaher/video/7620463871261773069,3/23/2026 7:51
Reach High. Dream Higher. Go Sky High. ⚡@Maybelline NY #maybellinepartner ,142100,6936,226,44,165,https://www.tiktok.com/@ilonamaher/video/7618230751032544525,3/17/2026 7:26
,65600,6452,184,111,96,https://www.tiktok.com/@ilonamaher/video/7617987036649098509,3/16/2026 15:40
March Madness® = Bracket Season: Which hotel amenity is your champion? #MarriottBonvoyPartner @Olivia Maher @Marriott Bonvoy ,56000,1091,30,9,36,https://www.tiktok.com/@ilonamaher/video/7617489949692136718,3/15/2026 7:31
Im no longer ashamed. Extroverts rise up.,310800,38400,1319,904,463,https://www.tiktok.com/@ilonamaher/video/7616980706585087245,3/13/2026 22:35
Thanks for having me @adidas @Stella McCartney ,152600,11100,277,45,142,https://www.tiktok.com/@ilonamaher/video/7613932454860066062,3/5/2026 16:26
I’m doing it all,190700,20900,741,113,250,https://www.tiktok.com/@ilonamaher/video/7613920438002978061,3/5/2026 15:39
It’s French ,616700,94700,366,2492,929,https://www.tiktok.com/@ilonamaher/video/7612329967665417486,3/1/2026 8:48
A lovely beach would hit right now @Sports Illustrated Swimsuit ,212700,23000,211,73,158,https://www.tiktok.com/@ilonamaher/photo/7611259300408806669,2/26/2026 0:00
HUGE Saturday night plans #pickledip @Kaylin and Kaylin Pickles ,455900,16100,314,180,391,https://www.tiktok.com/@ilonamaher/video/7609510594005208334,2/21/2026 18:27
I wouldn’t say I’m perfect… but whoever said ‘you are what you eat’ might be onto something. @Perfect Bar #PerfectlyReal #PerfectbarPartner,433500,9471,176,61,180,https://www.tiktok.com/@ilonamaher/video/7607863199412571406,2/17/2026 7:54
I will never escape dance. It always finds me @Dancing with the Stars #DWTS @DWTS Live! ,1200000,142800,266,929,971,https://www.tiktok.com/@ilonamaher/video/7607533380904815885,2/16/2026 10:34
"Frick you, DJ. Great song though. ",603600,53500,190,248,370,https://www.tiktok.com/@ilonamaher/video/7606744920216341774,2/14/2026 7:35
"@Team USA brought me to the Milan Olympics, of course I’m eating pasta already ",1600000,216300,1127,4087,2146,https://www.tiktok.com/@ilonamaher/video/7605949849745263886,2/12/2026 4:09
So GO USA!!,464400,64600,508,822,825,https://www.tiktok.com/@ilonamaher/video/7605539706213764365,2/11/2026 1:38
Saying my hymn,5000000,697500,817,5128,7217,https://www.tiktok.com/@ilonamaher/video/7605006548003245326,2/9/2026 15:09
Big dawg here #Super Bowl,2200000,258200,1551,2023,2304,https://www.tiktok.com/@ilonamaher/video/7604678667033120013,2/8/2026 17:57
Which vibe are you ,188000,4627,46,44,149,https://www.tiktok.com/@ilonamaher/video/7604371321333599501,2/7/2026 22:04
Outfit for the night @Sports Illustrated @Sports Illustrated Swimsuit ,1500000,161200,2553,2459,1825,https://www.tiktok.com/@ilonamaher/video/7604310369816956173,2/7/2026 18:07
For anyone wondering,291200,21400,414,189,372,https://www.tiktok.com/@ilonamaher/video/7603914906882018574,2/6/2026 16:33
Exactly what we’re going for ,1100000,72200,324,217,614,https://www.tiktok.com/@ilonamaher/video/7603856144284568845,2/6/2026 12:45
,528500,80100,1883,1287,958,https://www.tiktok.com/@ilonamaher/video/7602094894966000910,2/1/2026 18:50
Movers and shakers,1000000,69300,600,482,877,https://www.tiktok.com/@ilonamaher/video/7599533117874933023,1/25/2026 21:09
Just on my mind,2200000,326200,3849,5080,8823,https://www.tiktok.com/@ilonamaher/video/7599071727376796941,1/24/2026 15:19
It’s too important a message not to share again.,6900000,622500,7245,8898,8181,https://www.tiktok.com/@ilonamaher/video/7593985611103472910,1/10/2026 22:22
Not a bad thing to be known for ,2000000,145400,1555,983,1877,https://www.tiktok.com/@ilonamaher/video/7591995145260649741,1/5/2026 13:38
Not the silken folds 🦪 ,3600000,545300,2055,116100,14300,https://www.tiktok.com/@ilonamaher/video/7590423452373372173,1/1/2026 7:59
I just really love the Olympics ,3100000,272300,636,1245,2784,https://www.tiktok.com/@ilonamaher/video/7582731958770224439,12/11/2025 14:32
,861900,119200,1607,1414,2314,https://www.tiktok.com/@ilonamaher/photo/7580842152247266574,12/6/2025 0:00
Actually an extremely delicious steak,2400000,193500,4217,2816,2695,https://www.tiktok.com/@ilonamaher/video/7579512678855544077,12/2/2025 22:20
Where my @Betches at?,765600,115700,1800,5357,1994,https://www.tiktok.com/@ilonamaher/video/7579120955826474295,12/1/2025 21:00
Disturbing the peace ,625200,70700,521,2125,1057,https://www.tiktok.com/@ilonamaher/video/7578759604289441037,11/30/2025 21:37
Lifting weights angry can really lead to gains,1000000,132900,787,611,2552,https://www.tiktok.com/@ilonamaher/video/7578021929622326541,11/28/2025 21:55
To my young girlies out there trying to figure it out. ,2300000,336900,5801,11300,16500,https://www.tiktok.com/@ilonamaher/video/7576421585586883854,11/24/2025 14:25
,3400000,595500,2241,1429,2323,https://www.tiktok.com/@ilonamaher/photo/7575803616913657101,11/23/2025 0:00
I’ll take a pickle straight up ,660700,43400,328,508,477,https://www.tiktok.com/@ilonamaher/video/7574662750480141623,11/19/2025 20:40
Like I can’t stop serving,393500,22700,370,111,264,https://www.tiktok.com/@ilonamaher/video/7574613972503121207,11/19/2025 17:30
We are gonna sing this to our kids,2200000,228800,673,1670,13600,https://www.tiktok.com/@ilonamaher/video/7571288540940717367,11/10/2025 18:26
Used to be me but super happy Elaine is such an amazing partner for Alan. @Dancing with the Stars #DWTS ,4000000,529400,1114,20300,6550,https://www.tiktok.com/@ilonamaher/video/7570463735878389006,11/8/2025 13:05
@Jordan Conroy was runner up on DWTS Ireland. ,659600,85600,269,622,1070,https://www.tiktok.com/@ilonamaher/video/7570177107146444046,11/7/2025 18:33
"I’m not saying six packs are bad but I do firmly believe we aren’t all meant to have them. They are also not a determinant of fitness in any way. I am a two time Olympian and medalist and have never had visible abs in my 7 years of pro sports. Yet, I am still fitter, faster, and stronger than people who do. Be kind to your body and don’t let society/social media tell you only one thing is right.",4100000,414800,3699,4689,4656,https://www.tiktok.com/@ilonamaher/video/7569686305534250253,11/6/2025 10:48
You’re in the way,947900,103000,1323,953,1436,https://www.tiktok.com/@ilonamaher/video/7569080646254054711,11/4/2025 19:38
Like what is the holdup?!? Oh right…I’m single. ,2700000,342800,2407,1455,2739,https://www.tiktok.com/@ilonamaher/video/7569013963074178359,11/4/2025 15:19
She put it down and I had to ask what the heck is that. ,1200000,96900,778,1416,550,https://www.tiktok.com/@ilonamaher/video/7568965066431778062,11/4/2025 12:10
💋 Confidence coach activated 💋 26.2 miles of cheering later… my @Maybelline NY Super Stay Matte Ink is still going strong 😘 #NYCMarathon #MaybellinePartner #SuperStayMiles,265600,9522,204,65,179,https://www.tiktok.com/@ilonamaher/video/7568963120706768142,11/4/2025 12:02
"It felt only right since I have a Barbie coming out to be a Vintage Barbie, duh #barbie ",1100000,66000,642,347,676,https://www.tiktok.com/@ilonamaher/video/7567607524791274765,10/31/2025 21:22
"Buff Barbie, Ladies and Gentlemen",1400000,195900,777,1980,1900,https://www.tiktok.com/@ilonamaher/video/7567580687818034446,10/31/2025 19:38
Legs out ,1300000,134900,1942,1494,1800,https://www.tiktok.com/@ilonamaher/video/7565567677142502670,10/26/2025 9:26
Decided on a little darker makeup ,1900000,268300,2622,3589,3081,https://www.tiktok.com/@ilonamaher/video/7564978194420387085,10/24/2025 19:19
Sisters in Arms  Text ELAINE to 21523 ten times @Dancing with the Stars #DWTS ,1500000,205700,307,3052,2709,https://www.tiktok.com/@ilonamaher/video/7563841421292080439,10/21/2025 17:47
It ain’t much but it’s honest work ,715700,77300,233,2584,820,https://www.tiktok.com/@ilonamaher/video/7563424201651080478,10/20/2025 14:48
"I was cleaning out my closet and decided to try on all my jeans and see what fit. As I went along, I realized a lot weren’t fitting me anymore. I am not training full time right now and am not in Olympic Sevens shape. In my head, I want to be that size and be as I fit as I was but it’s not realistic for me. I’m trying to give myself some grace. Remember that my body is going to constantly change. Right now, I feel a little bigger but I’m being kind to myself. Giving her (my body) time to just be. I know that I was get back in Olympic shape and I also know that I will get out of it too. That’s life. That’s the journey our bodies will go on. So for now my belly stays and the jeans will go.",4400000,255200,1510,1888,3556,https://www.tiktok.com/@ilonamaher/video/7562261817750261005,10/17/2025 11:38
Got nervous they’d make me start dancing if I came back @Dancing with the Stars #DWTS ,1200000,121100,395,1392,3437,https://www.tiktok.com/@ilonamaher/video/7561523381397490974,10/15/2025 11:52
Something’s never change @Dancing with the Stars #DWTS ,1300000,191000,368,3921,2132,https://www.tiktok.com/@ilonamaher/video/7561507578405014798,10/15/2025 10:51
We did this months ago but had to post,791600,39000,156,446,632,https://www.tiktok.com/@ilonamaher/video/7557175111950929166,10/3/2025 18:39
Taking on London,584000,28200,242,93,424,https://www.tiktok.com/@ilonamaher/video/7556054259217763598,9/30/2025 18:09
"Behind the glam ✨ BTS with my sisters for the @Maybelline NY Super Stay Matte Ink shoot 💄 16HR wear, bold pigment, and zero smudge #MaybellinePartner",1000000,39500,681,378,1029,https://www.tiktok.com/@ilonamaher/video/7556002522444451086,9/30/2025 14:48
Turns out my love language is… a private chef 🍝 Thank you @airbnb for the beautiful home and chef service,651700,30600,485,232,522,https://www.tiktok.com/@ilonamaher/video/7555545968259714334,9/29/2025 9:17
,1200000,156200,546,428,1259,https://www.tiktok.com/@ilonamaher/video/7555486842024463629,9/29/2025 5:27
"When the sisters become friends, too 🫶🏼",439100,14900,159,26,148,https://www.tiktok.com/@ilonamaher/video/7555250834154573070,9/28/2025 14:11
History Making!,602800,33800,170,122,482,https://www.tiktok.com/@ilonamaher/video/7554779185554803981,9/27/2025 7:41
Heading to Mamma Mia the Party,1900000,162700,1151,1540,2119,https://www.tiktok.com/@ilonamaher/video/7553772181449149709,9/24/2025 14:33
"Ultimate pucker test, coached by @nicole406heavirland 😘 @Maybelline NY Super Stay Matte Ink stays flawless — transfer-proof, smudge-resistant, unstoppable 💄#MaybellinePartner",582700,15200,204,128,371,https://www.tiktok.com/@ilonamaher/video/7553646664213433631,9/24/2025 6:26
@adidas everything,880800,51400,567,269,680,https://www.tiktok.com/@ilonamaher/video/7553645612659461431,9/24/2025 6:22
"Snack. Sip. Repeat. 💋 @Maybelline NY Super Stay Matte Ink, bold pigment, 16HR wear, smudge-proof, transfer-proof, unstoppable color #MaybellinePartner",35700000,15300,169,347,544,https://www.tiktok.com/@ilonamaher/video/7552898055654231309,9/22/2025 6:01
,924600,95500,487,488,915,https://www.tiktok.com/@ilonamaher/video/7552267191861677325,9/20/2025 13:13
We both bad,359800,11400,102,30,123,https://www.tiktok.com/@ilonamaher/video/7552266891528506679,9/20/2025 13:12
Talkin bout your baby. DC: @brookeandjess ,3100000,132300,366,662,1613,https://www.tiktok.com/@ilonamaher/video/7552116243415715086,9/20/2025 3:28
Make sure to watch the @Rugby World Cup semi-finals this weekend @Sarah Bern @Portia Woodman ,1200000,132700,745,819,2257,https://www.tiktok.com/@ilonamaher/video/7550689373889498382,9/16/2025 7:11
"16HR stay, high-impact pigment, and zero smudge 💄 @Maybelline NY Super Stay Matte Ink lasts through whatever the day throws 💋#MaybellinePartner",15500000,5612,96,167,247,https://www.tiktok.com/@ilonamaher/video/7550672487571311903,9/16/2025 6:05
Rich in life because I have them.,347800,9751,81,98,190,https://www.tiktok.com/@ilonamaher/video/7550292312711007502,9/15/2025 5:30
We stay winning @Rugby World Cup @World Rugby #everybodywatcheswomenssports ,1900000,116600,470,686,1706,https://www.tiktok.com/@ilonamaher/video/7549956411250298126,9/14/2025 7:46
Straightened it just for it to start pouring out,2600000,139500,2020,686,1776,https://www.tiktok.com/@ilonamaher/video/7549937583971732749,9/14/2025 6:33
We are unwell.,381200,24700,141,521,279,https://www.tiktok.com/@ilonamaher/video/7549257666124664077,9/12/2025 10:35
Exciting things await. I can feel it,1200000,139400,838,710,1245,https://www.tiktok.com/@ilonamaher/video/7548019777428524343,9/9/2025 2:31
We’ll make it through,522700,40400,114,120,232,https://www.tiktok.com/@ilonamaher/video/7547409430011202871,9/7/2025 11:03
Don’t mess with me during this time,2700000,248400,898,1095,1868,https://www.tiktok.com/@ilonamaher/video/7547405723525811470,9/7/2025 10:48
How times change ,10800000,1500000,2934,14200,14900,https://www.tiktok.com/@ilonamaher/video/7546708347609697549,9/5/2025 13:42
"You ready for us, York? @Rugby World Cup @USA Rugby ",784900,59800,231,1074,583,https://www.tiktok.com/@ilonamaher/video/7546555501476203789,9/5/2025 3:49
It will change your life I swear,409400,30900,162,216,392,https://www.tiktok.com/@ilonamaher/video/7546315289219075341,9/4/2025 12:17
Almost that time again @Rugby World Cup ,1900000,154800,968,1169,2021,https://www.tiktok.com/@ilonamaher/video/7544028836615195918,8/29/2025 8:24
It’s all the same boring stuff anyway… “She looks like a man!” “She’s not even good” “Get her off steroids” You keep on living your sad lives and I’ll keep cashing my checks and living my best life.,3300000,394600,4908,1802,3377,https://www.tiktok.com/@ilonamaher/video/7543986059340811533,8/29/2025 5:38
The game is changing. @Rugby World Cup credit: @The GIST ,2900000,257700,1051,603,1575,https://www.tiktok.com/@ilonamaher/video/7541727366654004535,8/23/2025 3:33
"RED, white, and blue 🇺🇸 @Rugby World Cup ",7000000,577600,2548,2309,5452,https://www.tiktok.com/@ilonamaher/video/7541425966426492174,8/22/2025 8:04
Our coaches patience knows no bounds ,1300000,162800,296,2883,2229,https://www.tiktok.com/@ilonamaher/video/7541378398598270221,8/22/2025 4:59
Not our best look,522900,41100,173,319,408,https://www.tiktok.com/@ilonamaher/video/7540766183683804429,8/20/2025 13:24
This was the start of arm day ,4200000,213800,857,3857,3212,https://www.tiktok.com/@ilonamaher/video/7539898972006075661,8/18/2025 5:18
That’s the plan @Rugby World Cup ,758300,71000,204,504,757,https://www.tiktok.com/@ilonamaher/video/7539558642178133262,8/17/2025 7:18
Whatever you say officer 🙏🏼 ,8400000,1100000,5511,33300,16900,https://www.tiktok.com/@ilonamaher/video/7539217194522004791,8/16/2025 9:13
Women’s sports is really moving up.,559000,41700,177,476,673,https://www.tiktok.com/@ilonamaher/video/7539099885233098039,8/16/2025 1:37
,508200,44700,261,299,453,https://www.tiktok.com/@ilonamaher/video/7538901000879426830,8/15/2025 12:46
"The @Rugby World Cup kicks off in exactly one week in Sunderland, England. Let’s f***ing go",2200000,305200,1422,3786,4764,https://www.tiktok.com/@ilonamaher/video/7538833107349146893,8/15/2025 8:22
They really be doing too much,371600,28700,240,579,674,https://www.tiktok.com/@ilonamaher/video/7538535053991726391,8/14/2025 13:06
I think we can all agree on that,2500000,547300,4072,9892,5647,https://www.tiktok.com/@ilonamaher/video/7538453504176704782,8/14/2025 7:49
Exactly what I wanted,1300000,185500,660,832,1350,https://www.tiktok.com/@ilonamaher/video/7537690735382891789,8/12/2025 6:29
I know you all maul and scrum and make twenty tackles a game but we have to catch ball and run. Very hard.,290800,19600,46,165,232,https://www.tiktok.com/@ilonamaher/video/7537365626705284366,8/11/2025 9:28
Time of my life #olympics ,741700,99900,67,467,798,https://www.tiktok.com/@ilonamaher/video/7537315080845839629,8/11/2025 6:12
How is everyone in love? ,413300,43000,132,283,357,https://www.tiktok.com/@ilonamaher/video/7536574499236498743,8/9/2025 6:18
It’s like I’m working everyday,512100,26000,305,446,729,https://www.tiktok.com/@ilonamaher/video/7534839126596652343,8/4/2025 14:04
If you tell one…you gotta tell the other,737700,61600,139,676,543,https://www.tiktok.com/@ilonamaher/video/7534455588068134157,8/3/2025 13:15
These boots really do make me act different,584700,34900,320,679,456,https://www.tiktok.com/@ilonamaher/video/7533438479565360439,7/31/2025 19:28
Cowboy boots and rugby kit,404800,41000,216,686,376,https://www.tiktok.com/@ilonamaher/video/7533410482774953230,7/31/2025 17:40
Our S&C is so strong for putting up with us ,2000000,336500,194,3588,4492,https://www.tiktok.com/@ilonamaher/video/7533264373809171726,7/31/2025 8:13
,234900,18500,187,66,382,https://www.tiktok.com/@ilonamaher/photo/7532969923086175501,7/30/2025 0:00
Changed the game.,121700,2926,27,13,68,https://www.tiktok.com/@ilonamaher/video/7532956748232084791,7/30/2025 12:19
My message will always stay the same ,481300,71600,505,861,1156,https://www.tiktok.com/@ilonamaher/video/7532923766339292471,7/30/2025 10:11
Wealth aplenty,152700,11500,70,25,88,https://www.tiktok.com/@ilonamaher/video/7532636818026548535,7/29/2025 15:37
Tell me literally everything. You said it felt like what?,766000,83100,280,1483,763,https://www.tiktok.com/@ilonamaher/video/7532541432930864397,7/29/2025 9:27
Make a lovely iced coffee with us ,151700,6439,115,87,195,https://www.tiktok.com/@ilonamaher/video/7531112555633233166,7/25/2025 13:03
That counter was just too good not to use. ,387100,50300,515,1925,608,https://www.tiktok.com/@ilonamaher/video/7530701784243850509,7/24/2025 10:29
My teammates  are literally so strong and beautiful.,966500,132100,367,771,1004,https://www.tiktok.com/@ilonamaher/video/7530630548801195278,7/24/2025 5:52
A lil switch up ,1400000,138100,469,1326,1398,https://www.tiktok.com/@ilonamaher/video/7530044973857770766,7/22/2025 16:00
Fifteens is another level.,118700,3628,83,39,80,https://www.tiktok.com/@ilonamaher/video/7528912497940663566,7/19/2025 14:45
We will bring honor to you all.,975100,211100,531,1907,3800,https://www.tiktok.com/@ilonamaher/video/7528401444601335095,7/18/2025 5:42
Take up space. Pitch it faster. Run harder. Put another plate on the bar. And NEVER tone it down.,746400,108800,1004,1809,2291,https://www.tiktok.com/@ilonamaher/video/7527908940902911246,7/16/2025 21:51
It’s almost like being a True Original is the whole point ✨ #TJMaxxPartner,147900,5972,107,60,126,https://www.tiktok.com/@ilonamaher/video/7527340709427399949,7/15/2025 9:06
Those crabs get a proper adjustment,16300000,2100000,6306,247400,60800,https://www.tiktok.com/@ilonamaher/video/7526720581551557943,7/13/2025 16:59
Y’all gotta try this ,2500000,324000,3095,10200,5533,https://www.tiktok.com/@ilonamaher/video/7526679238754258189,7/13/2025 14:19
We riding dirty…to Dunkin,257100,21300,129,240,302,https://www.tiktok.com/@ilonamaher/video/7525972620022385933,7/11/2025 16:37
Thankfully I got over that @Dancing with the Stars #DWTS ,3800000,374000,229,292,3230,https://www.tiktok.com/@ilonamaher/video/7525622105036180750,7/10/2025 17:57
"Get outta here, weirdos",241600,19200,116,153,155,https://www.tiktok.com/@ilonamaher/video/7525087616610356494,7/9/2025 7:23
Can’t be sure but I’d imagine,4600000,566000,5019,5989,6148,https://www.tiktok.com/@ilonamaher/video/7524908213884488974,7/8/2025 19:47
We’re getting the band back together ,303500,23200,93,146,237,https://www.tiktok.com/@ilonamaher/video/7523780259896904973,7/5/2025 18:50
Please keep voting for me as the Breakthrough Athlete at the ESPYs @pitchprincess ,452900,40900,276,1180,667,https://www.tiktok.com/@ilonamaher/video/7522890974465510670,7/3/2025 9:19
We bring up the same stories pretty much every time,1000000,85600,116,4818,866,https://www.tiktok.com/@ilonamaher/video/7522355898044517646,7/1/2025 22:42
Went and got a good lift in. That always helps,4100000,514900,2548,6465,8857,https://www.tiktok.com/@ilonamaher/video/7521968555546447159,6/30/2025 21:39
Thanks to @pitchprincess for the video,410700,23500,61,79,358,https://www.tiktok.com/@ilonamaher/video/7521014105860345102,6/28/2025 7:55
"Oh, you thought I only bring the heat to games? So excited to be partnering with @TJ Maxx to celebrate all the True Originals breaking boundaries💃 💪 #TJMaxxPartner",267400,18500,253,189,325,https://www.tiktok.com/@ilonamaher/video/7520711848061062413,6/27/2025 12:23
"No, guys I have not had a bbl. The mirror was just slightly slanted upward",446100,51500,424,830,493,https://www.tiktok.com/@ilonamaher/video/7520051106978843918,6/25/2025 17:38
#Ad It's a good thing he's cute. 🐕🌞 #Coppertone #UnbeatablePerformance #CoppertoneSport #CoppertoneGirl @Coppertone USA ,159100,4762,54,46,80,https://www.tiktok.com/@ilonamaher/video/7520012225512328462,6/25/2025 15:08
🦋,284100,55100,670,737,616,https://www.tiktok.com/@ilonamaher/video/7519669751103147278,6/24/2025 16:59
Sorry I’m thicc and juicy. ,350000,51200,1389,930,909,https://www.tiktok.com/@ilonamaher/video/7518972964281322765,6/22/2025 19:55
I’ve never been chill a day in my life.,1400000,211700,334,5601,1731,https://www.tiktok.com/@ilonamaher/photo/7518817083434519863,6/22/2025 0:00
,1100000,163600,712,876,1560,https://www.tiktok.com/@ilonamaher/photo/7518540331655236878,6/21/2025 0:00
Have a word with my s&c if you see him around ,1300000,128800,164,305,652,https://www.tiktok.com/@ilonamaher/video/7518506966352678199,6/21/2025 13:46
My resume: 200lbs 5’10” Hot Can fight Honestly believes she would be a great actress,8900000,814900,3518,9855,9224,https://www.tiktok.com/@ilonamaher/video/7518452602560843022,6/21/2025 10:15
Try me,378100,40300,281,213,359,https://www.tiktok.com/@ilonamaher/video/7517656014947159309,6/19/2025 6:44
Play “Cool Girl” by Tove Lo,285800,30900,566,342,302,https://www.tiktok.com/@ilonamaher/video/7517619556005825806,6/19/2025 4:23
Why am I dancing so much?,374800,40700,271,342,313,https://www.tiktok.com/@ilonamaher/video/7517418737641803022,6/18/2025 15:24
My middle school French helped me with this,344300,48200,611,264,350,https://www.tiktok.com/@ilonamaher/video/7517240140188667150,6/18/2025 3:51
Dance credit me. This took me ten hours to choreograph. The studios alone cost me thousands.,326900,37000,270,191,351,https://www.tiktok.com/@ilonamaher/video/7517037844808895799,6/17/2025 14:45
That rhetoric is so tired ,975000,147800,558,872,1314,https://www.tiktok.com/@ilonamaher/video/7516588684007738667,6/16/2025 9:43
Keep ‘em coming ,3800000,467100,1899,47900,5772,https://www.tiktok.com/@ilonamaher/video/7515177205245234462,6/12/2025 14:25
True Originals don’t shy away from speaking their truth. Sound like you? Join us at the link in bio. 🤞 #tjmaxxpartner,153300,4733,66,47,90,https://www.tiktok.com/@ilonamaher/video/7515149789236022574,6/12/2025 12:39
Feeling cleansed. ,1100000,123400,447,30100,2785,https://www.tiktok.com/@ilonamaher/video/7514369527816178990,6/10/2025 10:11
"Sorry, @Olivia Maher – the best beach days are spent with @Coppertone USA ☀️🐕 #ad #UnbeatablePerformance",197000,8552,86,93,171,https://www.tiktok.com/@ilonamaher/video/7513657872178351391,6/8/2025 12:09
Keep it up.,2300000,467700,3175,9667,4657,https://www.tiktok.com/@ilonamaher/video/7513588998510546222,6/8/2025 7:42
Notice anything new about me? ,234000,7852,133,64,128,https://www.tiktok.com/@ilonamaher/video/7512848976010366250,6/6/2025 7:51
Feeling a little left out… Stream @Renee Elise Goldsberry new album “Who I Really Am” at Midnight!,3600000,516200,548,12200,13900,https://www.tiktok.com/@ilonamaher/video/7512629143687679274,6/5/2025 17:37
The most you’re getting is a side hug after we watch my highlights,750500,125600,713,3658,1885,https://www.tiktok.com/@ilonamaher/video/7512522978484260142,6/5/2025 10:46
@TJ Maxx is now the official sponsor of True Originals - starting with me. 👋 #tjmaxxpartner,177600,8891,88,68,155,https://www.tiktok.com/@ilonamaher/video/7512452212669304110,6/5/2025 6:11
Texts I send to my sister when he really pisses me off,1500000,168300,440,980,1078,https://www.tiktok.com/@ilonamaher/video/7512152345417960750,6/4/2025 10:47
I’m crying then I’m laughing then I’m angry than I’m crying again,988900,101100,1243,679,1548,https://www.tiktok.com/@ilonamaher/video/7511914861060803883,6/3/2025 19:26
I applaud myself ,7900000,1100000,3849,15300,8770,https://www.tiktok.com/@ilonamaher/video/7511743304266960171,6/3/2025 8:20
I have many sides. @Sports Illustrated Swimsuit ,1600000,177600,1253,3372,1992,https://www.tiktok.com/@ilonamaher/video/7511162992344550699,6/1/2025 18:48
I don’t think I’ve ever felt hotter in my life than I did at Miami Swimweek with @Sports Illustrated Swimsuit ,1200000,57100,810,1043,1593,https://www.tiktok.com/@ilonamaher/photo/7510967182604471595,6/1/2025 0:00
You talking to the wrong lady ,1000000,69600,375,483,641,https://www.tiktok.com/@ilonamaher/video/7510646380948409643,5/31/2025 9:23
It’s a full time job,1700000,129300,781,1344,1364,https://www.tiktok.com/@ilonamaher/video/7510634201050828078,5/31/2025 8:36
Had to double check nothing slipped out,1900000,335700,4584,8740,4413,https://www.tiktok.com/@ilonamaher/video/7510389181089123626,5/30/2025 16:45
I do it all,7200000,754700,2827,8043,11800,https://www.tiktok.com/@ilonamaher/video/7510268691687427374,5/30/2025 8:58
"Please hold the jokes, I’m trying to find the session plan. (We also have like three different chats for different things)",857900,87500,163,1261,992,https://www.tiktok.com/@ilonamaher/video/7508808133574331694,5/26/2025 10:30
